<?xml version="1.0" encoding="UTF-8"?>
<!DOCTYPE dataSource SYSTEM  "../dtd/connection.config.dtd">

<dataSource name="varsql">
	<type>local</type>
	<driver>org.h2.Driver</driver>
	<url>jdbc:h2:file:#resourePath#/varsql;AUTO_SERVER=TRUE;CACHE_SIZE=131072;</url>
	<username>sa</username>
	<password>sa</password>
	<max_active>10</max_active>
	<pool_option>max_idle=5;min_idle=5;</pool_option>
	<connection_option>sslConnection=true</connection_option>
	<timebetweenevictionrunsmillis>60000</timebetweenevictionrunsmillis>
	<test_while_idle>true</test_while_idle>
</dataSource>
